{
  "$schema": "../schemas/email-templates.schema.json",
  "version": "1.12.0",
  "capabilities": {
    "sendsEmail": false,
    "persistsInput": false,
    "externalRequests": false,
    "marketing": false
  },
  "fields": [
    {
      "id": "recipientName",
      "type": "shortText",
      "privacy": "personal",
      "maxLength": 80,
      "retainAcrossTemplates": true,
      "locales": {
        "en": {
          "label": "Recipient name",
          "help": "Name from the current conversation.",
          "example": "Alex"
        },
        "ru": {
          "label": "Имя получателя",
          "help": "Имя из текущей переписки.",
          "example": "Алекс"
        }
      }
    },
    {
      "id": "productName",
      "type": "shortText",
      "privacy": "public",
      "maxLength": 80,
      "retainAcrossTemplates": true,
      "locales": {
        "en": {
          "label": "Product name",
          "help": "Product connected to this message.",
          "example": "Atlas"
        },
        "ru": {
          "label": "Название продукта",
          "help": "Продукт, к которому относится письмо.",
          "example": "Atlas"
        }
      }
    },
    {
      "id": "requestTopic",
      "type": "shortText",
      "privacy": "personal",
      "maxLength": 160,
      "retainAcrossTemplates": true,
      "locales": {
        "en": {
          "label": "Request topic",
          "help": "Summarize the request.",
          "example": "Desktop licensing question"
        },
        "ru": {
          "label": "Тема обращения",
          "help": "Кратко сформулируйте обращение.",
          "example": "Вопрос о лицензии"
        }
      }
    },
    {
      "id": "referenceId",
      "type": "shortText",
      "privacy": "sensitive",
      "maxLength": 64,
      "retainAcrossTemplates": true,
      "locales": {
        "en": {
          "label": "Reference",
          "help": "Support or transaction reference.",
          "example": "QT-1842"
        },
        "ru": {
          "label": "Номер",
          "help": "Номер обращения или операции.",
          "example": "QT-1842"
        }
      }
    },
    {
      "id": "requestedDetails",
      "type": "longText",
      "privacy": "sensitive",
      "maxLength": 1200,
      "retainAcrossTemplates": true,
      "locales": {
        "en": {
          "label": "Details needed",
          "help": "List only information needed next.",
          "example": "Exact error text and the action before it appeared."
        },
        "ru": {
          "label": "Нужные сведения",
          "help": "Только сведения для следующего шага.",
          "example": "Точный текст ошибки и предыдущее действие."
        }
      }
    },
    {
      "id": "replyCheckpoint",
      "type": "dateTime",
      "privacy": "personal",
      "maxLength": 100,
      "retainAcrossTemplates": true,
      "locales": {
        "en": {
          "label": "Next update",
          "help": "Honest next-response time.",
          "example": "5 August, 14:00 UTC"
        },
        "ru": {
          "label": "Следующее обновление",
          "help": "Честный срок следующего ответа.",
          "example": "5 августа, 14:00 UTC"
        }
      }
    },
    {
      "id": "permissionName",
      "type": "shortText",
      "privacy": "sensitive",
      "maxLength": 120,
      "retainAcrossTemplates": true,
      "locales": {
        "en": {
          "label": "Permission",
          "help": "System permission involved.",
          "example": "Microphone access"
        },
        "ru": {
          "label": "Разрешение",
          "help": "Нужное системное разрешение.",
          "example": "Доступ к микрофону"
        }
      }
    },
    {
      "id": "nextSteps",
      "type": "longText",
      "privacy": "sensitive",
      "maxLength": 1200,
      "retainAcrossTemplates": true,
      "locales": {
        "en": {
          "label": "Next steps",
          "help": "Ordered concrete actions.",
          "example": "Open Settings, review access, then reopen the product."
        },
        "ru": {
          "label": "Следующие шаги",
          "help": "Конкретные действия по порядку.",
          "example": "Откройте Настройки, проверьте доступ и перезапустите продукт."
        }
      }
    },
    {
      "id": "workaround",
      "type": "longText",
      "privacy": "sensitive",
      "maxLength": 1200,
      "retainAcrossTemplates": true,
      "locales": {
        "en": {
          "label": "Workaround",
          "help": "Reversible temporary route.",
          "example": "Retry with the smaller source selected."
        },
        "ru": {
          "label": "Временное решение",
          "help": "Обратимый временный способ.",
          "example": "Повторите с источником меньшего размера."
        }
      }
    },
    {
      "id": "fixVersion",
      "type": "shortText",
      "privacy": "public",
      "maxLength": 80,
      "retainAcrossTemplates": true,
      "locales": {
        "en": {
          "label": "Fix version",
          "help": "Release containing the fix.",
          "example": "1.9.0"
        },
        "ru": {
          "label": "Версия исправления",
          "help": "Релиз с исправлением.",
          "example": "1.9.0"
        }
      }
    },
    {
      "id": "updateUrl",
      "type": "url",
      "privacy": "sensitive",
      "maxLength": 2048,
      "retainAcrossTemplates": true,
      "locales": {
        "en": {
          "label": "Update link",
          "help": "Official HTTPS update route.",
          "example": "https://example.invalid/update"
        },
        "ru": {
          "label": "Ссылка обновления",
          "help": "Официальная HTTPS-ссылка.",
          "example": "https://example.invalid/update"
        }
      }
    },
    {
      "id": "actionUrl",
      "type": "url",
      "privacy": "security",
      "maxLength": 2048,
      "retainAcrossTemplates": true,
      "locales": {
        "en": {
          "label": "Action link",
          "help": "Single-use HTTPS link.",
          "example": "https://example.invalid/action"
        },
        "ru": {
          "label": "Ссылка действия",
          "help": "Одноразовая HTTPS-ссылка.",
          "example": "https://example.invalid/action"
        }
      }
    },
    {
      "id": "actionCode",
      "type": "code",
      "privacy": "security",
      "maxLength": 32,
      "retainAcrossTemplates": true,
      "locales": {
        "en": {
          "label": "One-time code",
          "help": "Short-lived product code.",
          "example": "482731"
        },
        "ru": {
          "label": "Одноразовый код",
          "help": "Краткосрочный код продукта.",
          "example": "482731"
        }
      }
    },
    {
      "id": "eventDateTime",
      "type": "dateTime",
      "privacy": "sensitive",
      "maxLength": 100,
      "retainAcrossTemplates": true,
      "locales": {
        "en": {
          "label": "Date and time",
          "help": "Include a clear timezone.",
          "example": "5 August 2026, 14:00 UTC"
        },
        "ru": {
          "label": "Дата и время",
          "help": "Укажите понятный часовой пояс.",
          "example": "5 августа 2026, 14:00 UTC"
        }
      }
    },
    {
      "id": "eventContext",
      "type": "shortText",
      "privacy": "sensitive",
      "maxLength": 240,
      "retainAcrossTemplates": true,
      "locales": {
        "en": {
          "label": "Event context",
          "help": "Approximate product-supplied context.",
          "example": "Safari on macOS · Prague region"
        },
        "ru": {
          "label": "Контекст события",
          "help": "Примерный контекст от продукта.",
          "example": "Safari на macOS · регион Праги"
        }
      }
    },
    {
      "id": "deletionDate",
      "type": "dateTime",
      "privacy": "sensitive",
      "maxLength": 100,
      "retainAcrossTemplates": true,
      "locales": {
        "en": {
          "label": "Deletion date",
          "help": "Scheduled or completed date.",
          "example": "12 August 2026"
        },
        "ru": {
          "label": "Дата удаления",
          "help": "Плановая или фактическая дата.",
          "example": "12 августа 2026"
        }
      }
    },
    {
      "id": "completedSummary",
      "type": "longText",
      "privacy": "sensitive",
      "maxLength": 1200,
      "retainAcrossTemplates": true,
      "locales": {
        "en": {
          "label": "Completed result",
          "help": "State exactly what completed.",
          "example": "The archive was created with 248 items."
        },
        "ru": {
          "label": "Завершённый результат",
          "help": "Точно укажите результат.",
          "example": "Архив создан и содержит 248 элементов."
        }
      }
    },
    {
      "id": "remainingSummary",
      "type": "longText",
      "privacy": "sensitive",
      "maxLength": 1200,
      "retainAcrossTemplates": true,
      "locales": {
        "en": {
          "label": "Remaining work",
          "help": "State what did not complete.",
          "example": "Three files still need permission."
        },
        "ru": {
          "label": "Оставшаяся работа",
          "help": "Укажите незавершённую часть.",
          "example": "Для трёх файлов требуется разрешение."
        }
      }
    },
    {
      "id": "failureReason",
      "type": "longText",
      "privacy": "sensitive",
      "maxLength": 800,
      "retainAcrossTemplates": true,
      "locales": {
        "en": {
          "label": "Known reason",
          "help": "Confirmed reason without speculation.",
          "example": "The source file is no longer available."
        },
        "ru": {
          "label": "Известная причина",
          "help": "Подтверждённая причина без догадок.",
          "example": "Исходный файл больше недоступен."
        }
      }
    },
    {
      "id": "resultCounts",
      "type": "shortText",